{
  "compatibility_posture": "compatible",
  "copied_replay_package_path": "/home/charlie/Forge/ecosystem/pact/harness/handoffs/slice_07_replay_package_rcpt_d18e33cda28dc140.zip",
  "export_id": "exp_0a495bdc2cbe83e2",
  "handoff_id": "handoff_0bf673ca1d026597",
  "package_label": "operator_replay",
  "packet_class": "policy_response_packet",
  "receipt_id": "rcpt_d18e33cda28dc140",
  "replay_package_filename": "slice_07_replay_package_rcpt_d18e33cda28dc140.zip",
  "replay_package_sha256": "f1d9cb0dbee8b07810b00bf4f5cdd42d14b6ed98077134507cc1067eb11c08c2",
  "result_kind": "safe_failure",
  "schema_version": "1.0.0",
  "source_manifest_path": "/home/charlie/Forge/ecosystem/pact/harness/exports/slice_07_export_manifest_rcpt_d18e33cda28dc140.json",
  "source_replay_package_path": "/home/charlie/Forge/ecosystem/pact/harness/exports/slice_07_replay_package_rcpt_d18e33cda28dc140.zip"
}
