{
  "compatibility_posture": "compatible",
  "copied_replay_package_path": "/home/charlie/Forge/ecosystem/pact/harness/handoffs/slice_07_replay_package_rcpt_0990c0414b9fec53.zip",
  "export_id": "exp_f4fed8fe38fa02b8",
  "handoff_id": "handoff_d7248ffcc9f46ce3",
  "package_label": "operator_replay",
  "packet_class": "search_assist_packet",
  "receipt_id": "rcpt_0990c0414b9fec53",
  "replay_package_filename": "slice_07_replay_package_rcpt_0990c0414b9fec53.zip",
  "replay_package_sha256": "ea16b64aebb03a15465fbf4cc66b18e022e1d4bea322e1b892561193a05d4a4b",
  "result_kind": "success",
  "schema_version": "1.0.0",
  "source_manifest_path": "/home/charlie/Forge/ecosystem/pact/harness/exports/slice_07_export_manifest_rcpt_0990c0414b9fec53.json",
  "source_replay_package_path": "/home/charlie/Forge/ecosystem/pact/harness/exports/slice_07_replay_package_rcpt_0990c0414b9fec53.zip"
}
