{
  "schema_version": "1.0.0",
  "handoff_id": "handoff_11111111aaaa",
  "receipt_id": "rcpt_11111111aaaa",
  "export_id": "exp_11111111aaaa",
  "package_label": "operator_replay",
  "packet_class": "answer_packet",
  "result_kind": "success",
  "compatibility_posture": "compatible",
  "source_manifest_path": "harness/exports/slice_07_export_manifest_rcpt_11111111aaaa.json",
  "source_replay_package_path": "harness/exports/slice_07_replay_package_rcpt_11111111aaaa.zip",
  "copied_replay_package_path": "harness/handoffs/slice_07_replay_package_rcpt_11111111aaaa.zip",
  "replay_package_filename": "slice_07_replay_package_rcpt_11111111aaaa.zip",
  "replay_package_sha256": "bbbbbbbbbbbbbbbbbbbbbbbbbbbbbbbbbbbbbbbbbbbbbbbbbbbbbbbbbbbbbbbb"
}
