{
  "compatibility_posture": "compatible",
  "copied_replay_package_path": "/home/charlie/Forge/ecosystem/pact/harness/handoffs/slice_07_replay_package_rcpt_c9d30156e36fd002.zip",
  "export_id": "exp_10e5eeaf9bb7ceb6",
  "handoff_id": "handoff_aae3fa1d51032ea0",
  "package_label": "operator_replay",
  "packet_class": "answer_packet",
  "receipt_id": "rcpt_c9d30156e36fd002",
  "replay_package_filename": "slice_07_replay_package_rcpt_c9d30156e36fd002.zip",
  "replay_package_sha256": "026b17d9c708b079f1d5dfa903b4908263435f505a43431585205c4a4f295f31",
  "result_kind": "success",
  "schema_version": "1.0.0",
  "source_manifest_path": "/home/charlie/Forge/ecosystem/pact/harness/exports/slice_07_export_manifest_rcpt_c9d30156e36fd002.json",
  "source_replay_package_path": "/home/charlie/Forge/ecosystem/pact/harness/exports/slice_07_replay_package_rcpt_c9d30156e36fd002.zip"
}
