{
  "compatibility_posture": "compatible",
  "copied_replay_package_path": "/home/charlie/Forge/ecosystem/pact/harness/handoffs/slice_07_replay_package_rcpt_83c93bd52dc41068.zip",
  "export_id": "exp_9bc203b69e9b9ec6",
  "handoff_id": "handoff_122fe7eb319056b0",
  "package_label": "operator_replay",
  "packet_class": "policy_response_packet",
  "receipt_id": "rcpt_83c93bd52dc41068",
  "replay_package_filename": "slice_07_replay_package_rcpt_83c93bd52dc41068.zip",
  "replay_package_sha256": "2a7460b0b80338e6a6752dbfa60cd7a6bf856af751e419734e3b1c42f1a21c80",
  "result_kind": "success",
  "schema_version": "1.0.0",
  "source_manifest_path": "/home/charlie/Forge/ecosystem/pact/harness/exports/slice_07_export_manifest_rcpt_83c93bd52dc41068.json",
  "source_replay_package_path": "/home/charlie/Forge/ecosystem/pact/harness/exports/slice_07_replay_package_rcpt_83c93bd52dc41068.zip"
}
